{"benchmark_valid":false,"cut_id":"aaaaaaaaaaaaaaaaaaaaaaaaaaaaaaaaaaaaaaaaaaaaaaaaaaaaaaaaaaaaaaaa","dataset_hash":"audit-fixture","direction":"lower","evaluator_sha256":"bbbbbbbbbbbbbbbbbbbbbbbbbbbbbbbbbbbbbbbbbbbbbbbbbbbbbbbbbbbbbbbb","git_sha":"a8e4ce8f1f7cdf2f518e867147c4f0b038d966c5","method_id":"gp/schema-compatibility-fixture","metric":"rmse","protocol":"fixture-only","receipt_sha256":"cccccccccccccccccccccccccccccccccccccccccccccccccccccccccccccccc","row_sha256":"a360915becc9533f8e2b2f42d5d4014f62abaf5122eb3a707022d461c8e0030a","run_id":"fixture","schema":"jope.score/v1","source":{"kind":"campaign","notes":"synthetic compatibility fixture; not a scientific score"},"ts_unix":1790630000,"value":1.2345678901234567}